{
  "schema_version": 3,
  "observation_id": "OUTPUT-OBS-DEMO-001",
  "epoch_id": "OUTPUT-EPOCH-DEMO-001",
  "goal_id": "GOAL-DEMO-001",
  "response_contract_id": "RESPONSE-DEMO-001",
  "response_contract_sha256": "9fc3dad26877e8e2b34a5b1bd2df728514eb6bc9b59b6bab745ce0054bf0769f",
  "response_contract": {
    "schema_version": 3,
    "contract_id": "RESPONSE-DEMO-001",
    "goal_id": "GOAL-DEMO-001",
    "origin": "FINALIZATION",
    "execution_path": "AGENT_TURN",
    "response_class": "RESULT",
    "completion_requirement": "RESULT_NOW",
    "channel": "CHAT",
    "status_delivery": "CHAT_REQUIRED",
    "mandatory_slots": ["RESULT", "EVIDENCE", "VERIFICATION", "ARTIFACT", "LIMITATIONS"],
    "soft_text_token_budget": 384,
    "budget_basis": "CLASS_DEFAULT",
    "text_policy": "CONCISE_COMPLETE",
    "information_delta": "FINAL",
    "artifact_policy": "WHEN_LARGE",
    "directive_placement": "STABLE_POLICY_ONLY",
    "budget_behavior": "EXPAND_FOR_REQUIRED_CONTENT",
    "goal_level_rebound_guard": true,
    "generated_content_accounting": "PROVIDER_OUTPUT_WITH_REASONING_AND_TOOL_ARGUMENT_ATTRIBUTION",
    "tool_result_projection_policy": "EVIDENCE_LIVENESS_ROUTED",
    "preserve_user_requested_format": true,
    "suppress_when": [],
    "hard_truncation_allowed": false,
    "rewrite_request_allowed": false,
    "reason": "DEMO_RESULT"
  },
  "prompt_request_id": "PROMPT-REQ-DEMO-002",
  "emission_origin": "FINALIZATION",
  "execution_path": "AGENT_TURN",
  "response_class": "RESULT",
  "provider_requests": 1,
  "generation_accounting": "PROVIDER_SPLIT",
  "generated_output_tokens": 192,
  "assistant_text_tokens": 130,
  "tool_call_argument_tokens": 42,
  "reasoning_tokens": 20,
  "unattributed_output_tokens": 0,
  "provider_output_includes_reasoning": true,
  "stop_reason": "stop",
  "completion_gate": "PASS",
  "user_answer_obligation": "FULFILLED",
  "mandatory_slots_required": ["RESULT", "EVIDENCE", "VERIFICATION", "ARTIFACT", "LIMITATIONS"],
  "mandatory_slots_fulfilled": ["RESULT", "EVIDENCE", "VERIFICATION", "ARTIFACT", "LIMITATIONS"],
  "response_directive_input_tokens": 18,
  "tool_result_source_tokens": 700,
  "tool_context_tokens": 320,
  "tool_context_avoided_tokens": 380,
  "rendered_output_chars": 620,
  "artifact_bytes": 4096,
  "suppressed_progress_events": 3,
  "duplicate_output_tokens_estimate": 0,
  "first_pass_acceptance_closed": true,
  "omission_followup_count": 0,
  "reopen_count": 0,
  "quality_gate": "PASS",
  "recorded_at": "2026-07-22T08:00:02Z"
}
